{"approvals":[],"case_id":"echo-success","expected":{"capabilities_executed":["det.echo"],"error_code":null,"lifecycle_history":["created","validating","running","succeeded"],"lifecycle_state":"succeeded","output":{"message":"Hello from a scaffolded Solution"},"validation":{"input":"valid","output":"valid"}},"input":{"message":"Hello from a scaffolded Solution"},"schema_version":"kora.solution.conformance-case/v0alpha1"}
